Code,Value,Description,col_name,Description_English
Low,1255,قروض حرفيين,ledgerCode,Premiums due to residential land financing loans 
Low,1257,قرض اعادة تمويل عقار,ledgerCode,Loans of craftsmen 
Low,1258,قرض شخصي مقابل تأمينات نقدية,ledgerCode,Reconstruction loan 
Low,1259,قرض تعليمي متناقص,ledgerCode,Personal loan vs. cash insurance 
Low,1260,قرض حاسوب,ledgerCode,Decreased tutorial loan 
Low,1261,قرض تمويل سلع بدون فائدة,ledgerCode,Computer Loan 
Low,1262,قرض اسكان التطوير الحضري,ledgerCode,Loan financing goods without interest 
Low,1263,قرض شراء الأراضي,ledgerCode,Urban Development Loan 
Low,1264,أقساط مستحقةقرض صندوق عربي للانماءالاقت,ledgerCode,Land purchase loan 
Low,1265,أقساط مستحقة قروض حرفيين,ledgerCode,Accounting Premiums 
Low,1266,أقساط مستحقة قروض عملاء البنك الدولي,ledgerCode,Premiums due to craftsmen 
Low,1267,اقساط مستحقة قرض اعادة تمويل عقار,ledgerCode,Premiums due to World Bank Customer Loans 
Low,1268,أقساطمستحقة/قرض شخصي مقابل تأمينات نقدية,ledgerCode,Premiums due to re-financing real estate 
Low,1269,أقساط مستحقة / قرض تعليمي متناقص,ledgerCode,Personal loan against cash insurance 
Low,1270,أقساط مستحقة /قرض حاسوب متناقص,ledgerCode,Plates due / decreased educational loan 
Low,1272,أقساط مستحقة/ قرض اسكان التطوير الحضري,ledgerCode,Plates due / decreased computer loan 
Low,1273,أقساط مستحقة قروض شراء أراضي,ledgerCode,Plates due / urban development housing loan 
Low,1274,قرض سكن كريم لعيش كريم,ledgerCode,Premiums due to purchase land loans 
Low,1275,أقساط مستحقة/قرض سكن كريم لعيش كريم,ledgerCode,Cream housing loan to live cream 
Low,1277,أقساط مستحقة/عملاء ش. خدمات الدفع,ledgerCode,Plates owed / cream housing loan to live cream 
Low,1300,سلف تمويل التصدير,ledgerCode,Plates due / clients. Payment services 
Low,1301,قرض شخصي استهلاكي,ledgerCode,Export financing 
Low,1302,قرض سيارة,ledgerCode,Personal loan consumed 
Low,1303,قروض الحرفين,ledgerCode,Car loan 
Low,1304,قروض تجمع بنكى بضمان الحكومة,ledgerCode,Loans of artists 
Low,1305,قروض تجمع بنكى بضمانات اخرى,ledgerCode,Banking loans with government guarantee 
Low,1306,سلف وقروض عملاءاخرى,ledgerCode,Banking loans with other guarantees 
Low,1308,قرض سكني,ledgerCode,Sulfur and other clients 
Low,1309,قرض دعم التمويل الإسكاني,ledgerCode,Residential loan 
Low,1310,أقساط مستحقة/قرض شخصي استهلاكي,ledgerCode,Loan support for housing financing 
Low,1311,أقساط مستحقة / قرض سيارة,ledgerCode,Personal loan consumed 
Low,1312,اقساط قروض عملاء مستحقة قرض البنك الدولى,ledgerCode,Premiums due / car loan 
Low,1313,أقساط مستحقة / قرض سكني,ledgerCode,Customer loan installments 
Low,1314,أقساطمستحقة/قرض شخصي مقابل تأمينات نقدية,ledgerCode,Plates due / residential loan 
Low,1315,أقساط مستحقة/ قروض الحرفيين,ledgerCode,Personal loan against cash insurance 
Low,1316,أقساط مستحقة/سلف وقروض عملاء أخرى,ledgerCode,Plates owed / craftsmen loans 
Low,1317,أقساط مستحقة/قرض دعم التمويل الإسكاني,ledgerCode,Plates due / predecessor and other clients loans 
Low,1318,أقساط مستحقة / قرض شخصي,ledgerCode,Plates owed / loan support for housing financing 
Low,1319,أقساط مستحقة / قرض تعليمي متناقص,ledgerCode,Personal Loan 
Low,1325,أقساط مستحقة/ق.إجازات متناقصة,ledgerCode,Plates due / decreased educational loan 
Low,1326,أقساط مستحقة /قرض حاسوب متناقص,ledgerCode,Plates due / signed 
Low,1328,أقساط مستحقة / قرض تعليمي,ledgerCode,Plates due / decreased computer loan 
Low,1330,سلف موظفين,ledgerCode,Plates due / educational loan 
Low,1332,قرض سكني / موظفين,ledgerCode,Predatory 
Low,1333,أقساط مستحقة / قرض حاسوب,ledgerCode,Residential loan / employees 
Low,1335,قروض تمويل سلع,ledgerCode,Plates due / a computer loan 
Low,1336,قروض تمويل أقساط تعليمية,ledgerCode,Financing loans 
Low,1337,قروض شراء أراضي سكنية,ledgerCode,Loans for educational premiums 
Low,1338,قروض تمويل سلع مستحقة,ledgerCode,Loans buy residential lands 
Low,1339,قروض تمويل أقساط تعليمية مستحقة,ledgerCode,Financing loans 
Low,1340,قروض متجدده,ledgerCode,Financing loans entitled educational premiums 
Low,1341,أقساط مستحقة قروض شراء أراضي سكنية,ledgerCode,Renewed loans 
Low,1342,قروض علاجية,ledgerCode,Premiums due to loans buy residential lands 
Low,1343,قروض علاجية مستحقة,ledgerCode,Treatment loans 
Low,1344,قرض دوار,ledgerCode,Treatment loans due 
Low,1345,اقساط مستحقة قرض دوار,ledgerCode,Rotary loan 
Low,1348,سلف تمويل متوسطة الاجل - دوار,ledgerCode,Premiums due to rotary loan 
Low,1349,اقساط مستحقة سلف تمويل متوسط الاجل دوار,ledgerCode,Advance Middle Ages - Roundabout 
Low,1350,قرض شخصي مقابل شهادات ايداع,ledgerCode,Premiums due to the advances of the medium term rotary funding 
Low,1351,قرض تعليمي متناقص,ledgerCode,Personal loan for deposit certificates 
Low,1353,قرض حاسوب,ledgerCode,Decreased tutorial loan 
Low,1354,قرض تمويل سلع بدون فائدة,ledgerCode,Computer Loan 
Low,1355,قرض شخصي,ledgerCode,Loan financing goods without interest 
Low,1356,قرض تعليمي,ledgerCode,personal loan 
Low,1358,قرض تمويل سلع,ledgerCode,Loan tutorial 
Low,1361,قرض وقود,ledgerCode,Loan financing goods 
Low,1363,قرض سكن كريم لعيش كريم,ledgerCode,Fuel loan 
Low,1364,أقساط مستحقة/قرض سكن كريم لعيش كريم,ledgerCode,Cream housing loan to live cream 
Low,1365,قرض سيارة متناقص,ledgerCode,Plates owed / cream housing loan to live cream 
Low,1366,اقساط مستحقة / قرض سيارة متناقص,ledgerCode,Loan decreased car 
Low,1368,قروض مسـاندة/عملاء,ledgerCode,Premiums due / decreased car 
Low,1369,أقساط مستحقة/برنامج تمويل التجارةالعربية,ledgerCode,Support Loans / Clients 
Low,1370,قرض إسكان التطوير الحضري,ledgerCode,Premiums due / trade finance program 
Low,1371,أقساط مستحقة / قرض إسكان التطوير الحضري,ledgerCode,Urban Development Loan 
Low,1373,تجاري بيزنس,ledgerCode,Plates owed / housing loan urban development 
Low,1374,أقساط مستحقة / تجاري بيزنس,ledgerCode,Commercial Business 
Low,1375,قروض متناقصة شركات صغيرة ومتوسطة,ledgerCode,Commercial / Commercial installments 
Low,1376,اقساط مستحقة قروض متاقصة صغيرة ومتوسطة,ledgerCode,Combined loans and middle and medium companies 
Low,1377,سلف تمويل متوسط الاجل,ledgerCode,Premiums due to small and medium-sized 
Low,1378,أقساط مستحقة / سلف تمويل متوسط الاجل,ledgerCode,Advances 
Low,1379,قرض متناقصةالصندوق العربي للانماءالاقتصا,ledgerCode,Premiums due / expeditiously 
Low,1380,أقساط مستحقةقرض صندوق عربي للانماءالاقتص,ledgerCode,Annotary loan for the Arab Fund for Development 
Low,1381,قرض متناقص / حكومة أو بكفالة الحكومة,ledgerCode,Answered accounts for an Arab Fund for Development 
Low,1382,أقساطمستحقة قروض متناقصة حكومةأوبكفالتها,ledgerCode,Deciscas / government or bail government 
Low,1384,اقساط مستحقة - المنتج الصحي,ledgerCode,I prejudice negotiable loans 
Low,1385,سلف وقروض عملاء أخرى,ledgerCode,Plates due - Health product 
Low,1386,قرض سكني,ledgerCode,Self and other clients 
Low,1387,قرض دعم التمويل الاسكاني,ledgerCode,Residential loan 
Low,1388,قرض سكني / موظفين,ledgerCode,Loan support for housing financing 
Low,1389,قرض شخصي,ledgerCode,Residential loan / employees 
Low,1390,تجـاري بيزنس,ledgerCode,personal loan 
Low,1391,قروض متناقصة شركات صغيرة ومتوسطة,ledgerCode,Commercial Business 
Low,1392,قروض تمويل صناعي,ledgerCode,Combined loans and middle and medium companies 
Low,1393,أقساط مستحقة/سلف وقروض عملاء أخرى,ledgerCode,Industrial funding loans 
Low,1394,أقساط مستحقة / قرض سكني,ledgerCode,Plates due / predecessor and other clients loans 
Low,1395,أقساط مستحقة/قرض دعم التمويل الاسكاني,ledgerCode,Plates due / residential loan 
Low,1396,أقساط مستحقة / قرض شخصي,ledgerCode,Plates owed / Loan support for housing financing 
Low,1397,أقساط مستحقة / تجاري بيزنس,ledgerCode,Personal Loan 
Low,1398,أقساط مستحقة قروض متناقصة صغيرة ومتوسطة,ledgerCode,Commercial / Commercial installments 
Low,1399,أقساط مستحقة / قروض تمويل صناعي,ledgerCode,Plates due to small and medium decreasing loans 
Low,1400,جاري مدين,ledgerCode,Plates due / industrial financing loans 
Low,1401,الجارى مدين المستندى,ledgerCode,Current 
Low,1402,البضائع المخزنة بوندد,ledgerCode,Current debtor debtor 
Low,1406,ذمم سحوبات بطاقات الائتمان,ledgerCode,The goods stored with 
Low,1412,جاري مدين / رواتب,ledgerCode,Dumps of credit cards 
Low,1413,بطاقات ائتمان (مستحقة),ledgerCode,Current / Salaries 
Low,1900,شيكات معادة,ledgerCode,Credit Cards (due) 
Low,1924,سحوبات عملاء بطاقات ائتمان,ledgerCode,Limited checks 
Low,1928,مدينون / عقارات مباعه بأقساط,ledgerCode,Discussion Credit Cards 
Low,1929,سحوبات بطاقات فيزا الكترون,ledgerCode,Madinoun / Real Estate Sold in installments 
Low,20,توفيري الذهبي,ledgerCode,Visa Card Draws 
Low,21,ودائع العملاء التوفير - غير مقيم,ledgerCode,Golden Tourie 
Low,2610,حسابات بنوك تجارية وشركات مالية/جارى,ledgerCode,Customer Deposits Saving - Non-Resident 
Low,2611,حسابات بنوك تجاريةوشركات مالية/اشعار,ledgerCode,Accounts of Commercial Banks and Financial Companies / Jari 
Low,2700,قروض من بنك مركزى/سلف تمويل تصدير,ledgerCode,Accounts Banking Banks Financial / Notice 
Low,2730,قروض من بنوك خارج المملكة,ledgerCode,Loans from Central Bank / Export Finance 
Low,3200,شيكات مصدقة,ledgerCode,Loans from banks outside the Kingdom 
Low,3208,شيكات مرتجعة,ledgerCode,Certified checks 
Low,3209,شيكات موقوفة,ledgerCode,Checking checks 
Low,3210,شيكات تسديد كمبيالات,ledgerCode,Checks suspended 
Low,3211,دفعات تسديد اقساط قروض البيع الاجل,ledgerCode,Completion checks 
Low,3212,دفعات تسديد أقساط قروض,ledgerCode,Payment payments for sale loan premiums 
Low,3216,شيكات مقبولة الدفع/النظام الجديد,ledgerCode,Loan payments payments 
Low,3264,دفعات تسديد جاري مدين,ledgerCode,Official checks / new order 
Low,3265,دفعات تسديد قروض دوارة,ledgerCode,Current payment payments 
Low,3296,أمانات عملاء,ledgerCode,Payments pay rotary loans 
Low,3305,أمانات عملاء / تجزئة,ledgerCode,Client secretaries 
Low,4300,كمبيالات عملاء مودعة للتحصيل,ledgerCode,Client secretaries / retail 
Low,4301,شيكات عملاء مودعة للتحصيل,ledgerCode,Complaints for collectible clients 
Low,4306,شيكات مودعه مقابل تسهيلات-قروض دوارة,ledgerCode,Checks for collection clients 
Low,50,شهادات ايداع العملاء-مقيم,ledgerCode,Checked checks for facilities - rotary loans 
Low,51,شهادات ايداع/عملاء غير مقيمين,ledgerCode,Customer deposit certificates - Resident 
Low,5301,مودعو شيكات للتحصيل/عملاء,ledgerCode,Certificates of deposit / non-resident clients 
Low,5306,مودعو شيكات مقابل تسهيلات-قروض دوارة,ledgerCode,Collectible checks / clients 
Low,5410,مودعو شيكات مصادر سداد,ledgerCode,Checks for checks - rotary loans 
Low,60,توفيري كلاسيك,ledgerCode,Check out sources of payment 
Low,61,توفير تعليمي,ledgerCode,Classic 
Low,8700,ايجار صناديق الأمانات,ledgerCode,Provide educational 
Medium,1203,اوراق تجارية مخصومة/بنوك,ledgerCode,Rent Safety boxes 
Medium,1204,اوراق تجارية مخصومة/بنوك,ledgerCode,Discounted business papers / banks 
Medium,1213,اوراق تجارية مخصومة مستحقة/بنوك,ledgerCode,Discounted business papers / banks 
Medium,1802,تامينات مدفوعة مقدما,ledgerCode,Commercial papers are owed / bank 
Medium,1922,سحوبات عملاء بطاقات الائتمان,ledgerCode,Paid in advance 
Medium,2071,استاذ تامينات نقدية لعقود تداول بالهامش,ledgerCode,Credit Card Drawings 
Medium,2229,شهادات الإيداع,ledgerCode,Professor of cash tactics for contract circulation 
Medium,2601,ودائع البنك المركزى الخاضعة لاشعار,ledgerCode,Deposit certificates 
Medium,2612,ودائع بنوك تجاريةوشركات مالية/لاجل,ledgerCode,Deposits of central bank subject to notice 
Medium,2613,شهادات ايداع بنوك تجارية وشركات مالية,ledgerCode,Deposits of business banks and financial companies 
Medium,2614,ودائع بنوك تجارية/لأجل يوم واحد,ledgerCode,Certificates deposit of commercial banks and financial companies 
Medium,2615,ودائع بنوك تجارية وشركات مالية/لاجل,ledgerCode,Commercial bank deposits / one day 
Medium,2621,ودائع مؤسسات مصرفيةاخرى/اشعار,ledgerCode,Commercial bank deposits and financial companies / for 
Medium,2622,ودائع مؤسسات مصرفية/لاجل,ledgerCode,Deposits of banking institutions / notice 
Medium,2630,ودائع بنوك خارج المملكة /جارى,ledgerCode,Deposits of banking institutions / 
Medium,2631,ودائع بنوك خارج المملكة/اشعار,ledgerCode,Banks outside the Kingdom / Jari 
Medium,2632,ودائع بنوك خارج المملكة/لاجل,ledgerCode,Bank deposits outside the Kingdom / Notice 
Medium,2633,شهادات ايداع بنوك خارج المملكة,ledgerCode,Deposits of banks outside the Kingdom / for 
Medium,2634,ودائع بنوك خارج المملكة / لاجل,ledgerCode,Certificates deposit banks outside the Kingdom 
Medium,2706,قرض الصندوق العربي للإنماء الاقتصادي,ledgerCode,Deposits of banks outside the Kingdom / for 
Medium,2800,تامينات نقدية,ledgerCode,Arab Fund Loan for Economic Development 
Medium,2801,تأمينات نقدية / بطاقات ائتمان,ledgerCode,Cash insurance 
Medium,2802,تأمينات نقدية / تجاري توفيري,ledgerCode,Cash / Credit Cards 
Medium,2803,تأمينات نقدية / تسهيلات أفراد,ledgerCode,Cash / Commercial Insurance 
Medium,2804,تأمينات شهادات إيداع/تسهيلات,ledgerCode,Monetary insurance / personnel facilities 
Medium,2805,تامينات شهادات ايداع / بطاقات ائتمان,ledgerCode,Deposit certificates / facilities 
Medium,2806,تأمينات نقديه مقابل تسهيلات,ledgerCode,Certification Certificates / Credit Cards 
Medium,2807,تأمينات نقديه/بطاقات ائمان,ledgerCode,Cash versus facilities 
Medium,2808,تأمينات نقديه/تجاري توفيري,ledgerCode,Cash / Safe Memories 
Medium,2809,تأمينات نقديه/تسهيلات افراد,ledgerCode,Cash / Commercial Insurance 
Medium,2810,تامينات نقدية مقابل اعتمادات مستندية,ledgerCode,Cash Insurance / Facilities 
Medium,2811,تامينات نقدية مقابل سحوبات اعتماد زمنى,ledgerCode,Cash for documentary credits 
Medium,2812,تامينات نقدية مقابل سحوبات تحصيل مكفولة,ledgerCode,Cash insurance vs. 
Medium,2813,تامينات نقدية مقابل كفالات,ledgerCode,Cash entries for guaranteed collection withdrawals 
Medium,2814,تأمينات تجيير / إصدار إذونات تسليم,ledgerCode,Cash versus fulfillments 
Medium,2815,تامينات على مستندات الاعتمادات,ledgerCode,Career insurance / release delivery editors 
Medium,2820,تامينات صناديق الأمانات,ledgerCode,Taminations on credits documents 
Medium,31,ودائع خاضعةلاشعار/عملاء غير مقيمين,ledgerCode,Security boxes 
Medium,32,حسابات تحت الطلب بعوائد استثمارات مالية,ledgerCode,Related deposits / non-resident clients 
Medium,40,ودائع لأجل ثابتة - عملاء,ledgerCode,Demand accounts with financial investments 
Medium,41,ودائع العملاء لاجل -غير مقيم,ledgerCode,Deposits for fixed - clients 
Medium,43,وديعة لأجل ذهبية,ledgerCode,Customer deposits for - non-resident 
Medium,4304,شيكات عملاء مرسلة للتحصيل,ledgerCode,A golden deposit 
Medium,4311,شيكات بنوك وفروع واردة للتحصيل,ledgerCode,Check clients for collection 
Medium,45,وديعة متحركة,ledgerCode,Checks and incomplete branches 
Medium,46,ودائع لاجل متحركة/غير مقيم,ledgerCode,Animation 
Medium,47,وديعة ثابتة,ledgerCode,Deposits for animated / non-resident 
Medium,48,أمانات ودائع عملاء لأغراض الإقامة,ledgerCode,Fixed deposit 
Medium,4813,أسهم عملاء لدينا/وحفظها لحساب العميل,ledgerCode,Customer depositors for accommodation 
Medium,4817,اسناد قرض شركة بندار للتجارة والاستثمار,ledgerCode,Our clients shares / and save them to calculate the client 
Medium,5304,أصحاب شيكات عملاء مرسلة للتحصيل,ledgerCode,Bandar's loan for trade and investment 
Medium,54,وديعة ثابتة,ledgerCode,Holders check customers for collection 
Medium,55,وديعة متحركة,ledgerCode,Fixed deposit 
Medium,5817,مشتركي اسناد قرض شركة بندار للتجارة,ledgerCode,Animation 
Medium,71,تأمينات التبادل بالعملة الأجنبية/عملاء,ledgerCode,Pendar Trading Loan 
Medium,72,تأمينات عمليات تبادل العملات,ledgerCode,Foreign currency exchange insurance / clients 
Customer_Class,0,لايوجد,CUS_CLASS,
Customer_Class,1,جواز سفر,CUS_CLASS,Ahpe 
Customer_Class,15,اخرى,CUS_CLASS,passport 
Customer_Class,2,هوية احوال مدنية,CUS_CLASS,Other 
Customer_Class,3,دفتر عائلة,CUS_CLASS,Civil conditions identification 
Customer_Class,4,سجل تجاري,CUS_CLASS,Family notebook 
Customer_Class,5,رخصة مهن,CUS_CLASS,Commercial Record 
Customer_Class,50,CHAIRMAN,CUS_CLASS,Careers license 
Customer_Class,51,MEMBER OF THE BOARD,CUS_CLASS,CHAIRMAN 
Customer_Class,52,GENERAL MANAGER,CUS_CLASS,MEMBER OF THE BOARD 
Customer_Class,54,SHAREHOLDER,CUS_CLASS,GENERAL MANAGER 
Customer_Class,6,رخصة تأسيس,CUS_CLASS,SHAREHOLDER 
Customer_Class,60,الشركات التابعة للمصرف,CUS_CLASS,Establishment license 
Customer_Class,61,الشركات الشقيقة للمصرف,CUS_CLASS,Banking companies 
Customer_Class,62,حقوق الاقلية للمصرف,CUS_CLASS,The sister companies for the bank 
Customer_Class,63,الشركات التابعة للشركات التابعه,CUS_CLASS,The minority rights of the bank 
Customer_Class,64,الشركات الشقيقة للشقيقة للمصرف,CUS_CLASS,Companies affiliated with companies 
Customer_Class,65,حصص الاقلية للحصص الاقلية,CUS_CLASS,The sister companies for the sister for the bank 
Customer_Class,7,وثيقة سفر,CUS_CLASS,Many minority quotas 
Customer_Class,90,شركاء في شركة الوساطة,CUS_CLASS,passport 
Customer_Class,91,أزواج/زوجات الشركاء,CUS_CLASS,Partners in brokerage company 
Customer_Class,92,أولاد/بنات الشركاء,CUS_CLASS,Pairs / Wives Partners 
Customer_Class,93,موظفين في شكركة الوساطة,CUS_CLASS,Children / Girls Partners 
Customer_Class,94,أزواج/زوجات الموظفين,CUS_CLASS,Employees in Brokerage Company 
Customer_Class,95,أولاد/بنات الموظفين,CUS_CLASS,Pairs / wives staff 
Customer_Class,96,OTHER COMPANIES,CUS_CLASS,Sons / Girls Staff 
High,124,استخراج البترول الخام والغاز الطبيعي,ECO_SEC,
High,148,صناعة مشتقات البترول المكررة,ECO_SEC,Extraction of crude oil and natural gas 
High,150,صناعة الاسمدة ومركبات النيتروجين,ECO_SEC,Duplicate petroleum products 
High,197,صناعة المجوهرات,ECO_SEC,Fertilizer and Nitrogen Vehicles 
High,219,بيع السيارات,ECO_SEC,Jewelry Industry 
High,321,جمعيات التسليف التعاونيه,ECO_SEC,Car Sale 
High,322,شركات الرهن العقاري,ECO_SEC,Cooperative Credit Associations 
High,323, شركات الاقراض المؤسسات الماليه,ECO_SEC,Mortgage Companies 
High,324,شركات التأجير التمويلي,ECO_SEC,Lending Companies Financial Institutions 
High,325,خدمات مالية اخرى,ECO_SEC,Leasing companies 
High,326,شركات الأسهم والوساطه الماليه,ECO_SEC,Other Financial Services 
High,327,شراء الأسهم بغرض المضاربه,ECO_SEC,Stock and financial services companies 
High,328,شراء الأسهم للغير,ECO_SEC,Buy stocks for speculation 
High,337,بطاقات ائتمانية,ECO_SEC,Buy shares for others 
High,348,استخراج النفط والغاز الطبيعي,ECO_SEC,Credit cards 
High,388,الصرافه,ECO_SEC,Extraction of oil and natural gas 
High,390,المؤسسات الماليه العامله في تجارة الأسهم,ECO_SEC,exchange money 
High,391,المضاربون,ECO_SEC,Financial institutions working in stock trade 
High,392,الوسطاء الماليون,ECO_SEC,Speculators 
High,395,بطاقات ائتمانية,ECO_SEC,Financial Brokers 
High,397,الأسهم,ECO_SEC,Credit cards 
High,42,تجارة السيارات وقطع غيارها,ECO_SEC,Stock 
High,48,شركات الصرافة,ECO_SEC,Car trade and spare parts 
High,65,مكاتب السياحة والسفر,ECO_SEC,Exchange companies 
High,72,المضاربون (تمويل شراء أسهم),ECO_SEC,Travel and tourism offices 
High,73,بيوت الخصم,ECO_SEC,Speculators (financing stock shares) 
High,74,الشركات المالية الاخرى,ECO_SEC,Discount houses 
Low,0,لا يوجد,ECO_SEC,Other financial companies 
Low,1,مالية عامة,ECO_SEC,There is no 
Low,10,"حمضيات, فواكه,قمح, حبوب اخرى, خضار",ECO_SEC,General Finance 
Low,11,الزيتون والتبغ,ECO_SEC,"Citrus, fruit, wheat, other grains, vegetables "
Low,12,المواشي والدواجن والاسماك والنحل,ECO_SEC,Olive and tobacco 
Low,123,,ECO_SEC,"Livestock, poultry, fish and bees "
Low,125,مقالع الحجارة والرمل والطين والرخام,ECO_SEC,male 
Low,126,استخراج المعادن والاسمدة الكيميائية,ECO_SEC,"Stones, stones, sand, marble "
Low,127,انتاج وحفظ اللحوم ومشتقاتها,ECO_SEC,Metal extract and chemical fertilizer 
Low,128,حفظ الفواكه والخضار,ECO_SEC,Production and conservation of meat and derivatives 
Low,129,صناعة الدهون النباتية والحيوانية,ECO_SEC,Save fruits and vegetables 
Low,13,الصناعات الزراعية (داخل المزرعة),ECO_SEC,Plant and animal fat industry 
Low,130,صناعة منتجات الألبان و مشتقاتها,ECO_SEC,Agricultural Industries (inside the farm) 
Low,131,صناعة الحبوب المطحونة,ECO_SEC,Manufacture of dairy products and derivatives 
Low,132,صناعة اغذية الحيوانات,ECO_SEC,Refted grain industry 
Low,133,صناعة المعجنات ومشتقاتها,ECO_SEC,Animal Food Industry 
Low,134,تقطير المشروبات الروحية,ECO_SEC,Pastry industry and derivatives 
Low,135,صناعة شراب الشعير,ECO_SEC,Flying spirits 
Low,136,صناعة العصائر والمياه المعدنية,ECO_SEC,Barley 
Low,137,غزل وحياكة الخيوط المنسوجة,ECO_SEC,Juices and metal water industry 
Low,138,صناعة البسط والسجاد,ECO_SEC,Yarn and knitting woven thread 
Low,139,صناعة المنسوجات الاخرى,ECO_SEC,Manufacture of rugs and carpets 
Low,14,تجارة المنتوجات الزراعية وتسويقها,ECO_SEC,Other textile industry 
Low,140,صناعة الكروشيه واللوحات الفنية,ECO_SEC,Trading and marketing of agricultural products 
