Code,Value,Description,col_name,Description_English
High,12,رئيس مجلس ادارة,profession,chairman 
High,13,نائب رئيس مجلس ادارة,profession,Vice Chairman of the Board of Directors 
High,14,عضو مجلس ادارة,profession,Member of the Board of Directors 
High,15,مدير عام,profession,Director general 
High,16,نائب مدير عام,profession,Deputy General Manager 
High,27,موظف بنك,profession,Banker 
High,29,محاسب,profession,Accountant 
High,30,وزير,profession,Minister 
High,31,قاضي,profession,Judge 
High,32,سفير,profession,Ambassador 
High,33,نائب,profession,Deputy 
High,34,عين,profession,Eye 
High,35,عميد,profession,dean 
High,36,لواء,profession,Grud 
High,37,رئيس حكومة,profession,President 
High,38,رئيس دولة,profession,President 
High,39,سياسي بارز,profession,Large political 
High,40,منصب حكومي لدى دولة اجنبية,profession,Government is a foreign country 
High,41,شخص معرض سياسي اجنبي,profession,A foreign political exhibition 
High,42,شخص عسكري لدى دولة اجنبية,profession,A military person with a foreign country 
High,5,مقاول,profession,contractor 
High,8,محامي,profession,Attorney 
Low,11,حرفي,profession,Letter 
Low,18,حلاق,profession,Barber 
Low,19,لحام,profession,Wa 
Low,20,موظف,profession,Officer 
Low,21,متقاعد,profession,Persuaded 
Low,22,طالب,profession,Student 
Low,23,ربة منزل,profession,House wife 
Low,24,رئيس قسم,profession,Head of the Department 
Low,26,سائق,profession,Driver 
Low,28,طباخ (شيف),profession,Cook (chef) 
Low,3,مدرس,profession,teacher 
Low,4,مزارع,profession,Farmer 
Low,6,نجار,profession,Carpenter 
Low,7,حداد,profession,Haddad 
Low,9,ممرض,profession,Nurse 
Medium,1,طبيب,profession,A doctor 
Medium,10,تاجر,profession,dealer 
Medium,17,مدير,profession,Manager 
Medium,2,مهندس,profession,Engineer 
Medium,25,صاحب شركة (عمل),profession,Company (work) 
 , ,ممرض,profession,Nurse 
High,1041,ارصده لدى بنوك خارج المملكه / اشعار,ledgerCode,
High,1050,شيكات برسم القبض (اوراق مشتراه),ledgerCode,I made you at banks outside the kingdom / notice 
High,1120,استثمارات فى الاسهم,ledgerCode,Checks Capture (Paper Buy) 
High,1121,إستثمارات في الأسهم/خارجية,ledgerCode,Investments in stocks 
High,1122,استثمارات في الاسهم لاغراض المتاجره,ledgerCode,Investments in stocks / external 
High,1125,إتفاقيات إعادة شراء,ledgerCode,Investments in stocks for shops 
High,1130,محافظ استثماريه مداره من قبل الغير,ledgerCode,Reproduction agreements 
High,1211,كمبيالات واسناد بنكية مخصومة مستحقة,ledgerCode,Investment Governor orbit by others 
High,1372,سحوبات اعتمادات واردة مخصومة,ledgerCode,Complaints and discounted banknotes are due 
High,1403,سحوبات مكفولة مدفوعة / إعتمادات,ledgerCode,Discounts are discounted and discounted 
High,1404,الكفالات المصادره المدفوعة,ledgerCode,Paid and credits 
High,1405,سحوبات مكفولة مدفوعة / بوالص تحصيل,ledgerCode,Guarantees paid 
High,1408,سحوبات مكفولة مدفوعة/برنامج تجارة عربيه,ledgerCode,Drawing paid and collectible 
High,1858,ايجار صناديق الامانات مستحقة غير مقبوضة,ledgerCode,Drawing Drawings Driven / Arab Trade Program 
High,1897,الصناديق الحديدية / التغطية الآلية,ledgerCode,Rent unaccompanied safety funds 
High,1923,بطاقات مدفوعة مقدما,ledgerCode,Ferrous boxes / automatic coverage 
High,1926,سحوبات عملاء الشركة الاردنية لخدمة الدفع,ledgerCode,Paid cards 
High,1931,سحوبات البنوك الأخرىعلىأجهزةالصراف الآلي,ledgerCode,Drawings of the Jordanian Company for Payment Service 
High,1995,شراءسحوبات زمنية مقبولة/وبوالص/واعتمادات,ledgerCode,Distribution of other banks 
High,1996,الإعتمادات التصديريه المدفوعه,ledgerCode,Purchase of accepted periods of / pulses / and credits 
High,1997,تمويل الى مستفيد خارجي/تعهدات,ledgerCode,Export credits paid 
High,2000,مراكز العملات الاجنبية,ledgerCode,Financing to an external beneficiary / pledges 
High,2010,مركز عملة/بيع آني برسم التسليم,ledgerCode,Foreign exchange centers 
High,2011,مركز عملة/بيع آجل,ledgerCode,Currency Center / Sell Annie Platform Delivery 
High,2012,مركز عملة/شراء آني برسم الإستلام,ledgerCode,Currency Center / Selling Age 
High,2013,مركز عملة/شراء آجل,ledgerCode,Currency center / purchase Annie der 
High,2070,استاذ عملاء هامش متاجرة,ledgerCode,Currency / Purchase Center 
High,2501,,ledgerCode,Professor margin trading clients 
High,2821,تامينات امناء الصناديق,ledgerCode,male 
High,2825,تأمينات صناديق حديديه/عملاء,ledgerCode,Fund secretaries 
High,3202,شيكات مباعة وغير مصروفة,ledgerCode,Iron box insurance / clients 
High,3284,البطاقات المدفوعة مسبقاً,ledgerCode,Sold and non-expense checks 
High,3323,سحوبات عملاء البنك على أجهزةالصراف الآلي,ledgerCode,Pre-paid cards 
High,3324,سحوبات عملاء البنك على نقاط البيع,ledgerCode,Bank clients with automated arts 
High,3326,أمانات شراء المديونبات من البنوك الأخرى,ledgerCode,Bank clients with points of sale 
High,4000,تعهدات عملاء /اعتمادات مستندية صادرة,ledgerCode,Purchase of debts from other banks 
High,4001,تعهدات عملاء/اعتمادات مستنديةزمنية صادرة,ledgerCode,Customer commitments / documentary credits issued 
High,4002,تعهدات عملاء/برنامج تمويل تجارة عربيه,ledgerCode,Customers / Credit Credits 
High,4010,تعهدات بنوك/اعتمادات مستندية واردة,ledgerCode,Customer Customers / Finance Program 
High,4011,تعهدات بنوك/اعتمادات مستندية زمنية واردة,ledgerCode,Incoming documentation 
High,4020,تعهدات البنوك/اعتمادات تصدير عملاء اطلاع,ledgerCode,Incoming consideration of banks / credits 
High,4021,تعهدات البنوك/اعتمادات تصدير اطلاع عام,ledgerCode,Bank pledges / Credits Export customers 
High,4022,تعدات البنوك/اعتمادات تصدير عملاء زمنية,ledgerCode,Bank pledges / export credits 
High,4023,تعهدات البنوك/اعتمادات تصدير زمنية (عام),ledgerCode,Banking / Credits Export Time Customers 
High,4024,تعهدات بنوك/اعتمادتصديرمحول إطلاع عملاء,ledgerCode,Banking pledges / time export credits (General) 
High,4025,تعهدات بنوك/اعتماد تصدير محولة إطلاع عام,ledgerCode,Campaigns / Customers' commitments 
High,4026,تعهدات بنوك/اعتمادتصدير محول زمنية عملاء,ledgerCode,Creditors / Adoption of Export Export 
High,4027,تعهدات بنوك/إعتمادتصدير محول زمنية (عام),ledgerCode,Customers / Customer Customer Adapter 
High,4028,مستندات مطابقة إطلاع/اعتمادات تصديرعملاء,ledgerCode,Covenants / Separation (General) 
High,4029,مستندات مطابقة إطلاع/اعتمادات تصدير عام,ledgerCode,Matching documents / ad credentials 
High,4030,مستندات بخلافات إطلاع/اعتماد تصدير عملاء,ledgerCode,Matching documents / general export credits 
High,4032,مستندات بخلافات إطلاع/اعتماد تصدير عام,ledgerCode,Documents with disagreements / adoption of clients export 
High,4033,مستندات مطابقة زمنية/اعتماد تصدير عملاء,ledgerCode,Documents with public export 
High,4034,مستندات مطابقة زمنية/اعتماد تصدير عام,ledgerCode,Documents matching time / adoption of clients export 
High,4035,مستندات بخلافات زمنية/اعتماد تصدير عملاء,ledgerCode,Documents matching time / adoption of general export 
High,4036,مستندات بخلافات زمنية/اعتماد تصدير عام,ledgerCode,Documents in time variations / adoption of clients export 
High,4037,تعهدات بنوك/سحوبات زمنية,ledgerCode,Documents with time variations / adoption of general export 
High,4100,تعهدات عملاء/سحوبات زمنية مكفولة صادرة,ledgerCode,Corps of banks / time dysfunction 
High,4101,تعهدات عملاء/سحوبات زمنيةقروض تجارةعربيه,ledgerCode,Customer pledges / outgoing periods of time 
High,4110,تعهدات بنوك/سحوبات زمنية مكفولة واردة,ledgerCode,Customer Customers / Drawings Traders 
High,4111,سحوبات مقبولة مكفولة بوالص تحصيل صادرة,ledgerCode,Incoming interest in banks / incoming time 
High,4112,تعهدات سحوبات مقبولةمكفولةبوالص تحصيل صا,ledgerCode,Acceptable loads are guaranteed by issued collection 
High,4200,تعهدات عملاء/كفالات,ledgerCode,The pledges of defaults acceptable 
High,4220,تعهدات /كفالات واردة مقابل كفالات صادرة,ledgerCode,Customer commitments / guarantees 
High,4221,تعهد بنك/كفالات واردة مقابل تسهيلات اخرى,ledgerCode,Credit / guarantees contained in exchange for issued sponsors 
High,4222,تعهدات لصالح الغير/البنك التجاري الأردني,ledgerCode,Bank / Companies in exchange for other facilities 
High,4303,بوالص التحصيل الصادرة,ledgerCode,Commitments to others / Commercial Bank of Jordan 
High,4305,شيكات مودعة مقابل تسهيلات-جاري مدين,ledgerCode,Boarding issued 
High,4320,بوالص التحصيل الواردة,ledgerCode,Official checks for facilities - Jari 
High,4330,سحوبات بوالص تحصيل واردة مقبولة,ledgerCode,The collection of incoming 
High,4331,سحوبات بوالص تحصيل واردة مكفولة,ledgerCode,Pulls with an acceptable incoming collection 
High,4410,شيكات مصادر سداد,ledgerCode,Incoming detailed 
High,4500,تعهدات الفروع المحلية-شراء آني,ledgerCode,Checks for payment sources 
High,4501,تعهدات الفروع المحلية-شراء آجل,ledgerCode,Popies of local branches - buy Annie 
High,4502,تعهدات الفروع المحلية-شراء اختياري,ledgerCode,Local Branches - Purchase Age 
High,4503,تعهدات الفروع المحلية-شراء سواب,ledgerCode,Local branches pledges - optional purchase 
High,4504,تعهدات الفروع المحلية-شراء مراجحه,ledgerCode,Popies of local branches - buy swab 
High,4510,تعهدات الفروع الخارجية-شراء آني,ledgerCode,Pedies of local branches - purchase 
High,4511,تعهدات الفروع الخارجية-شراء آجل,ledgerCode,External branches - buy Annie 
High,4512,تعهدات الفروع الخارجية-شراء اختياري,ledgerCode,External Branches - Purchase Age 
High,4513,تعهدات الفروع الخارجية-شراء سواب,ledgerCode,External branches - optional purchase 
High,4514,تعهدات الفروع الخارجية-شراء مراجحة,ledgerCode,External branches - Purchase of Sawab 
High,4520,تعهدات العملاء - شراء آني,ledgerCode,External branches - purchase 
High,4521,تعهدات العملاء - شراء آجل,ledgerCode,Customer Pedies - Buy Annie 
High,4522,تعهدات العملاء - شراء اختياري,ledgerCode,Customer Pedies - Buy Age 
High,4523,تعهدات العملاء - شراء سواب,ledgerCode,Customer pledges - Optional purchase 
High,4524,تعهدات العملاء - شراء مراجحه,ledgerCode,Customer pledges - Buy Spa 
High,4530,تعهدات البنوك - شراء أني,ledgerCode,Customer pledges - buy a curry 
High,4531,تعهدات البنوك - شراء آجل,ledgerCode,Bank pledges - buy 
High,4532,تعهدات البنوك - شراء اختياري,ledgerCode,Bank pledges - buy a line 
High,4533,تعهدات البنوك - شراء سواب,ledgerCode,Bank pledges - buy optional 
High,4534,تعهدات البنوك - شراء مراجحة,ledgerCode,Bank pledges - Purchase of Swab 
High,4540,التزامات الفروع المحلية-بيع آني,ledgerCode,Bank pledges - buy a successful 
High,4541,التزامات الفروع المحلية-بيع آجل,ledgerCode,Obligations of local branches - selling Annie 
High,4542,التزامات الفروع المحلية-بيع اختياري,ledgerCode,Losses Local Branches - Selling Age 
High,4543,التزامات الفروع المحلية-بيع سواب,ledgerCode,Obligations of local branches - optional sale 
High,4544,التزامات الفروع المحلية-بيع مراجحه,ledgerCode,Local branches' obligations 
High,4550,التزامات الفروع الخارجية-بيع آني,ledgerCode,Obligations of local branches - selling 
High,4551,التزامات الفروع الخارجية-بيع آجل,ledgerCode,External Branches - Sell Annie 
High,4552,التزامات الفروع الخارجية-بيع اختياري,ledgerCode,External branches - Selling Age 
High,4553,التزامات الفروع الخارجية-بيع سواب,ledgerCode,External branches - optional sale 
High,4554,التزامات الفروع الخارجية-بيع مراجحة,ledgerCode,External branches - Selling Sell 
High,4560,التزامات العملاء - بيع آني,ledgerCode,External branches - sale 
High,4561,التزامات العملاء - بيع آجل,ledgerCode,Customer Obligations - Sell Annie 
High,4562,التزامات العملاء - بيع اختياري,ledgerCode,Customer commitments - Selling Age 
High,4563,التزامات العملاء - بيع سواب,ledgerCode,Customer commitments - Optional sale 
High,4564,التزامات العملاء - بيع مراجحه,ledgerCode,Customer commitments - Sell Sell 
High,4570,التزامات البنوك - بيع أني,ledgerCode,Customer commitments - selling 
High,4571,التزامات البنوك - بيع آجل,ledgerCode,Banks' Obligations - Sell Any 
High,4572,التزامات البنوك - بيع اختياري,ledgerCode,Bankings - Selling Age 
High,4573,التزامات البنوك - بيع سواب,ledgerCode,Bankings - Optional sale 
High,4574,التزامات البنوك - بيع مراجحة,ledgerCode,Banking Obligations - Selling Swab 
High,4811,أذونات خزينة لعملاء لدينا,ledgerCode,Bankings - Selling Sell 
High,4818,تعهدات تنفيذ المشاريع لصالح البنك-كفالات,ledgerCode,Treasury permissions for our customers 
High,4820,تعهدات عملاء مدينة مباشرة,ledgerCode,Project implementation pledges for the Bank - Guarantees 
High,4821,تعهدات لصالح الغير,ledgerCode,Direct City Customers 
High,5000,اعتمادات عملاء مستندية صادرة,ledgerCode,Popies for others 
High,5001,اعتمادات عملاء مستندية زمنية صادرة,ledgerCode,Documentary customer credits issued 
High,5002,اعتمادات عملاء زمنية/قروض تجارة عربيه,ledgerCode,Credits of issued documentary clients issued 
High,5010,اعتمادات مستندية واردة,ledgerCode,Credits of time clients / Arab trade loans 
High,5011,اعتمادات مستندية زمنية واردة,ledgerCode,Documentary credits are incoming 
High,5020,اعتمادات تصدير عملاء اطلاع,ledgerCode,First documentary credits are incoming 
High,5021,اعتمادات تصدير اطلاع/عام,ledgerCode,Export customer export credits 
High,5022,اعتمادات تصدير زمنية عملاء,ledgerCode,Export appropriations 
High,5023,اعتمادات تصدير زمنية (عام),ledgerCode,Credits export clients 
High,5024,اعتمادات تصدير محولة إطلاع عملاء,ledgerCode,Time export credits (General) 
High,5025,اعتمادات تصدير محولة إطلاع (عام),ledgerCode,Export credits converted clients 
High,5026,اعتمادات تصدير محولة زمنية عملاء,ledgerCode,Export credits: General 
High,5027,اعتمادات تصدير محولة زمنية/عام,ledgerCode,Export credits for customer time 
High,5028,مستندات مطابقة إطلاع/اعتمادات تصديرعملاء,ledgerCode,Export credits / year / year 
High,5029,مستندات مطابقة إطلاع/اعتمادات تصدير عام,ledgerCode,Matching documents / ad credentials 
High,5030,مستندات بخلافات إطلاع/اعتماد تصدير عملاء,ledgerCode,Matching documents / general export credits 
High,5032,مستندات بخلافات إطلاع/اعتماد تصدير عام,ledgerCode,Documents with disagreements / adoption of clients export 
High,5033,مستندات مطابقة زمنية/اعتماد تصدير عملاء,ledgerCode,Documents with public export 
High,5034,مستندات مطابقة زمنية/اعتماد تصدير عام,ledgerCode,Documents matching time / adoption of clients export 
High,5035,مستندات بخلافات زمنية/اعتماد تصدير عملاء,ledgerCode,Documents matching time / adoption of general export 
High,5036,مستندات بخلافات زمنية/اعتماد تصدير عام,ledgerCode,Documents in time variations / adoption of clients export 
High,5037,سحوبات اعتمادات تصدير,ledgerCode,Documents with time variations / adoption of general export 
High,5100,سحوبات عملاء زمنية مكفولة صادرة,ledgerCode,Export plugs 
High,5101,سحوبات زمنية مكفولة/قروض التجارة العربية,ledgerCode,Drawing outgoing time clients 
High,5110,سحوبات زمنية مكفولة وارده,ledgerCode,Guardianship / Arab trade loans 
High,5111,تعهدات سحوبات مقبولةمكفولةبوالص تحصيل صا,ledgerCode,Timers are guaranteed 
High,5112,تعهدات سحوبات مقبولةمكفولةبوالص تحصيل صا,ledgerCode,The pledges of defaults acceptable 
High,5200,الكفالات الصادرة,ledgerCode,The pledges of defaults acceptable 
High,5220,كفالات واردة ضمان لكفالات صادرة,ledgerCode,Guarantees outgoing 
High,5221,كفالات واردة ضمان لتسهيلات اخرى,ledgerCode,Incoming Guarantee Guarantee Guarantee 
High,5303,أصحاب بوالص التحصيل الصادرة,ledgerCode,Incoming guarantee guarantees for other facilities 
High,5305,مودعو شيكات مقابل تسهيلات-جاري مدين,ledgerCode,The owners of the issued collection 
High,5320,مودعو بوالص التحصيل الواردة,ledgerCode,Checks for checks - Jari Dadin 
High,5330,مودعو سحوبات بوالص تحصيل واردة مقبولة,ledgerCode,The collection of incoming 
High,5331,مودعو سحوبات بوالص تحصيل واردة مكفولة,ledgerCode,Pulls with incomplete collection 
High,5500,التزامات الفروع المحلية-شراء آني,ledgerCode,The models of the withdrawals are guaranteed 
High,5501,التزامات الفروع المحلية-شراء آجل,ledgerCode,Obligations of local branches - buy Annie 
High,5502,التزامات الفروع المحلية-شراء اختياري,ledgerCode,Losses Local Branches - Purchase Age 
High,5503,التزامات الفروع المحلية-شراء سواب,ledgerCode,Obligations of local branches - optional purchase 
High,5504,التزامات الفروع المحلية-شراء مراجحه,ledgerCode,Losses Local Branches - Purchase of Sawab 
High,5510,التزامات الفروع الخارجية-شراء آني,ledgerCode,Obligations of local branches - purchase per capita 
High,5511,التزامات الفروع الخارجية-شراء آجل,ledgerCode,External branches - buy Annie 
High,5512,التزامات الفروع الخارجية-شراء اختياري,ledgerCode,External branches - buying post 
High,5513,التزامات الفروع الخارجية-شراء سواب,ledgerCode,External branch commitments - optional purchase 
High,5514,التزامات الفروع الخارجية-شراء مراجحة,ledgerCode,Outsourcing of external branches - buy 
High,5520,التزامات العملاء - شراء آني,ledgerCode,External branches - buying successful 
High,5521,التزامات العملاء - شراء آجل,ledgerCode,Customer Obligations - Buy Annie 
High,5522,التزامات العملاء - شراء اختياري,ledgerCode,Customer Obligations - Buy Age 
High,5523,التزامات العملاء - شراء سواب,ledgerCode,Customer Obligations - Optional Buy 
High,5524,التزامات العملاء - شراء مراجحه,ledgerCode,Customer Obligations - Buy Spie 
High,5530,التزامات البنوك - شراء أني,ledgerCode,Customer Obligations - Purchase 
High,5531,التزامات البنوك - شراء آجل,ledgerCode,Banks' Obligations - Buy Any 
High,5532,التزامات البنوك - شراء اختياري,ledgerCode,Banks' Obligations - Purchase Age 
High,5533,التزامات البنوك - شراء سواب,ledgerCode,Bankings - Optional purchase 
High,5534,التزامات البنوك - شراء مراجحة,ledgerCode,Banks' Obligations - Buy Swab 
High,5540,تعهدات الفروع المحلية-بيع آني,ledgerCode,Banks' obligations - buy a swing 
High,5541,تعهدات الفروع المحلية-بيع آجل,ledgerCode,Pediages of local branches - selling Annie 
High,5542,تعهدات الفروع المحلية-بيع اختياري,ledgerCode,Local branches - Selling Age 
High,5543,تعهدات الفروع المحلية-بيع سواب,ledgerCode,Pedies of local branches - optional sale 
High,5544,تعهدات الفروع المحلية-بيع مراجحه,ledgerCode,Local branches pledges 
High,5550,تعهدات الفروع الخارجية-بيع آني,ledgerCode,Pedies of local branches - selling for sale 
High,5551,تعهدات الفروع الخارجية-بيع آجل,ledgerCode,External Branches - Sell Annie 
High,5552,تعهدات الفروع الخارجية-بيع اختياري,ledgerCode,External branches - Selling Age 
High,5553,تعهدات الفروع الخارجية-بيع سواب,ledgerCode,External branches - optional sale 
High,5554,تعهدات الفروع الخارجية-بيع مراجحة,ledgerCode,External subsidies 
High,5560,تعهدات العملاء - بيع آني,ledgerCode,External branches - sale 
High,5561,تعهدات العملاء - بيع آجل,ledgerCode,Customer pledges - Annie sale 
High,5562,تعهدات العملاء - بيع اختياري,ledgerCode,Customer pledges - Selling Age 
High,5563,تعهدات العملاء - بيع سواب,ledgerCode,Customer pledges - Optional sale 
High,5564,تعهدات العملاء - بيع مراجحه,ledgerCode,Customer pledges - Selling Sell 
High,5570,تعهدات البنوك - بيع أني,ledgerCode,Customer commitments - selling 
High,5571,تعهدات البنوك - بيع آجل,ledgerCode,Bank pledges - sell 
High,5572,تعهدات البنوك - بيع اختياري,ledgerCode,Bank pledges - Selling Age 
High,5573,تعهدات البنوك - بيع سواب,ledgerCode,Bank pledges - Optional sale 
High,5574,تعهدات البنوك - بيع مراجحة,ledgerCode,Bank pledges - Sell Sawab 
High,5818,كفالات واردة لتنفيذ مشاريع لصالح البنك,ledgerCode,Bank pledges - sale 
High,5819,تعهدات عملاء دائنة مباشرة,ledgerCode,Incoming guarantees to implement projects for the bank 
High,5821,تعهدات لصالح الغير,ledgerCode,Customer pledges directly 
High,5822,تعهدات لصالح الغير/البنك التجاري الأردني,ledgerCode,Popies for others 
High,8130,عوائدالمحافظ الاستثمارية,ledgerCode,Commitments to others / Commercial Bank of Jordan 
Low,10,جاري,ledgerCode,Proceeds of investment portfolios 
Low,1023,شهادات ايداع لدى بنوك تجاريةوشركات مالية,ledgerCode,Current 
Low,11,حسابات جارية تحت الطلب -غيرمقيم,ledgerCode,Filter certificates with business banks 
Low,1111,اسناد قروض شركات القطاع الخاص,ledgerCode,Current accounts under demand 
Low,1200,كمبيالات واسناد تجارية مخصومة,ledgerCode,Assign private sector loans 
Low,1210,كمبيالات واسناد تجارية مخصومة مستحقة,ledgerCode,Complaints and discounted 
Low,1214,كمبيالات سلف تمويل متوسط الاجل,ledgerCode,Complaints and assignment is defined 
Low,1215,كمبيالات سلف تمويل متوسط الاجل مستحقة,ledgerCode,Complaints predecessor 
Low,1250,قرض اعادة تمويل عقار,ledgerCode,Complaints predecessor is due 
Low,1251,اقساط مستحقة قرض اعادة تمويل عقار,ledgerCode,Reconstruction loan 
Low,1252,قرض شراء أرض سكنية,ledgerCode,Premiums due to re-financing real estate 
Low,1253,اقساط مستحقة قروض تمويل اراضي سكنية,ledgerCode,Loan Purchase Residential Land 
