Code,Value,Description,col_name,Description_English
Low,141,صناعة الملابس الجاهزة ما عدا الفرو,ECO_SEC,Crochet industry and art paintings 
Low,142,صناعة الحاويات الخشبية,ECO_SEC,Ready-made garment industry except fur 
Low,143,صناعة الفلين والقش,ECO_SEC,Wooden container industry 
Low,144,صناعة الورق المجعد وحاويات الورق الكرتون,ECO_SEC,Cork and straw industry 
Low,146,الطباعة,ECO_SEC,Curly paper industry and cardboard containers 
Low,147,الخدمات المرتبطة بالطباعة,ECO_SEC,printing 
Low,149,صناعة كيماويات اساسية عدا اسمدة نيتروجين,ECO_SEC,Services related to printing 
Low,15,تجارة المواد الزراعية ومعداتها,ECO_SEC,Manufacture of basic chemicals except for nitrogen fertilizers 
Low,151,صناعة البلاستيك الخام والمطاط الصناعي,ECO_SEC,Agricultural and agricultural materials 
Low,152,صناعة المبيدات الحشرية,ECO_SEC,Raw plastic industry and industrial rubber 
Low,153,صناعة الدهان والورنيش حبر ومعجون الطباعة,ECO_SEC,Industrial pesticide 
Low,154,صناعة الادوية والعقاقير الطبية,ECO_SEC,Paint industry and varnish ink and printing 
Low,155,صناعة الصابون والمنظفات والعطور,ECO_SEC,Medical and Drug Industry 
Low,156,صناعة المنتجات الكيماوية الاخرى,ECO_SEC,"Soap industry, detergents and perfumes "
Low,157,صناعة الاطارات والدواليب,ECO_SEC,Other chemical products industry 
Low,158,صناعة المنتجات المطاطية الاخرى,ECO_SEC,Tire and roller industry 
Low,159,صناعة المنتجات البلاستيكية,ECO_SEC,Industrial and other rubber products 
Low,16,منتجات زراعية اخرى (من ضمنها المشاتل ),ECO_SEC,Manufacture of plastic products 
Low,160,صناعة الزجاج ومشتقاته,ECO_SEC,Other agricultural products (including nurseries) 
Low,161,صناعة السيراميك الخام,ECO_SEC,Glass industry and derivatives 
Low,162,صناعة منتجات الفخار والسيراميك,ECO_SEC,Raw ceramic industry 
Low,163,صناعة الاسمنت والجير والجبص,ECO_SEC,Manufacture of pottery and ceramic products 
Low,164,صناعة ألواح الاسمنت والجبص,ECO_SEC,"Cement, lime and clutch industry "
Low,165,تقطيع وتشكيل الحجارة,ECO_SEC,Cement and cement panels 
Low,166,صناعة المنتجات غير المعدنية الاخرى,ECO_SEC,Cutting and forming stones 
Low,167,صناعة المعادن الثمينة غير القابلة للصدأ,ECO_SEC,Industrial non-metallic products 
Low,168,صب الحديد والفولاذ,ECO_SEC,The precious metal industry is not stainless 
Low,169,صناعة المعادن غير الحديد,ECO_SEC,Casting iron and steel 
Low,17,استصلاح الاراضي,ECO_SEC,Non-iron metal industry 
Low,170,صناعة التنكات والحاويات المعدنية,ECO_SEC,Land Reclamation 
Low,171,معالجة وطلاء المعادن,ECO_SEC,Mineral and metal container industry 
Low,172,صناعة سكاكين ومعدات يدوية وادوات معدنية,ECO_SEC,Treatment and metal coating 
Low,173,صناعة المنتجات المعدنية الاخرى,ECO_SEC,"Manufacture of knives, hand tools and metal tools "
Low,174,صناعة الروافع ومعدات النقل,ECO_SEC,Industrial Metal Products 
Low,175,صناعة الالات متعددة الاستخدامات,ECO_SEC,Manufacture of winches and transport equipment 
Low,176,صناعة الالات الزراعية والحرجية,ECO_SEC,Multi-usable machinery industry 
Low,177,صناعة معدات الالات,ECO_SEC,Agricultural and fragmentation industry 
Low,178,صناعة آلات الحفر واستخراج الحجارة,ECO_SEC,Machinery Industry 
Low,179,صناعة ماكنات حفظ اغذية ومشروبات وتبغ,ECO_SEC,Manufacture of drilling machines and extract stones 
Low,180,صناعة الالات ذات الاستخدامات الخاصة,ECO_SEC,Machine tools and drinks and drinks 
Low,181,صناعة التجهيزات المنزلية,ECO_SEC,Machinery of special uses 
Low,182,صناعة ماتورات مولدات والمحولات كهربائية,ECO_SEC,Household equipment industry 
Low,183,صناعة موزعات الكهرباء ومعدات المراقبة,ECO_SEC,Manufacture of generators and electric transformers 
Low,184,صناعة الأسلاك والكوابل المعزولة,ECO_SEC,Manufacture of electricity dispensers and surveillance equipment 
Low,185,صناعة الأسلاك والكوابل المعزولة,ECO_SEC,Wire industry and isolated cable 
Low,186,صناعة البطاريات,ECO_SEC,Wire industry and isolated cable 
Low,187,صناعة اللمبات الكهربائية ومعدات الانارة,ECO_SEC,Battery Industry 
Low,189,صناعة الراديو والتلفزيون وأجهزة الفيديو,ECO_SEC,Electrical lamps and lighting equipment 
Low,190,صناعة الادوات طبية وجراحية وتجبير الكسور,ECO_SEC,Industry and radio and video devices 
Low,191,صناعة معدات بصرية ومعدات تصويرفوتوغرافي,ECO_SEC,"Medical, surgical and surgical tools "
Low,192,صناعة هياكل السيارات,ECO_SEC,Manufacture of visual equipment and photographic equipment 
Low,193,صناعة القاطرات والمقطورات,ECO_SEC,Auto structures industry 
Low,194,صناعة محركات وقطع وتجهيزات السيارات,ECO_SEC,Industrial locomotives and trailers 
Low,195, بناء وصيانة القوارب واليخوت والطائرات,ECO_SEC,"Manufacture of engines, cutting and automotive equipment "
Low,196,صناعة معدات النقل الاخرى,ECO_SEC,"Building and maintenance of boats, yachts and aircraft "
Low,198,صناعة الادوات الموسيقية,ECO_SEC,Other transport equipment industry 
Low,199,الصناعات الاخرى,ECO_SEC,Musical instruments industry 
Low,2,عامة اخرى,ECO_SEC,Other Industries 
Low,20,"فوسفات, بوتاس, نحاس, ومعادن اخرى",ECO_SEC,Other general 
Low,200,انتاج وتجميع وتوزيع الكهرباء,ECO_SEC,"Phosphate, potas, copper, and other minerals "
Low,201,انتاج وتعبئة وتوزيع الغاز,ECO_SEC,"Production, assembly and distribution of electricity "
Low,202,انتاج وتعبئة الماء,ECO_SEC,"Production, packaging and distribution of gas "
Low,203,عصر وتعليب الزيتون,ECO_SEC,Production and mobilization of water 
Low,204,تعليب المنتجات الزراعيه,ECO_SEC,Olive and era era 
Low,205,مؤسسات خاصه وشركات ومكاتب عقاريه,ECO_SEC,Packing agricultural products 
Low,206,تجهيز موقع البناء,ECO_SEC,"Special institutions, companies and offices "
Low,207,انشاء المباني واعمال الهندسة المدنية,ECO_SEC,Construction site 
Low,208,تجهيز المباني,ECO_SEC,Construction of buildings and civil engineering works 
Low,209,تشطيب المباني,ECO_SEC,Processing of buildings 
Low,210,تأجير المعدات الانشائية,ECO_SEC,Finishing buildings 
Low,211,انشاء طرق و الجسور,ECO_SEC,Rental of construction equipment 
Low,212,الجمعيات التعاونيه الإسكانيه,ECO_SEC,Construction of roads and bridges 
Low,213,شراء أراضي وابنيه بغرض البيع والتأجير,ECO_SEC,Cooperative Associations 
Low,214,شراء اراضي وابنيه,ECO_SEC,Purchase of land and professions for sale and rent 
Low,215,بيع بالجملة للموادغذائية ومشروبات والتبغ,ECO_SEC,Purchase of land and capacity 
Low,216,بيع المفرق في ألاغذية والمشروبات والتبغ,ECO_SEC,"Sell wholesale for solids, drinks and tobacco "
Low,217,بيع مفرق اغذية ومشروبات تبغ للمحلات مخصص,ECO_SEC,"Selling Mafraq in Alam, Drinks and Tobacco "
Low,218,تجارة اللحوم والدواجن والأسماك,ECO_SEC,Sell junction food and beverage for custom shops 
Low,220,صيانة وتجهيز السيارات,ECO_SEC,"Trading meat, poultry and fish "
Low,221,بيع قطع غيار السيارات,ECO_SEC,Maintenance and processing of cars 
Low,222,بيع وصيانة الدراجات وقطع غيارها,ECO_SEC,Sell Auto Parts 
Low,223,البيع بالجملة للآلات والمعدات والتجهيزات,ECO_SEC,Sell and maintenance of cycling and spare parts 
Low,224,البيع بالجملة لمواد البناءو تدفئة و تكيف,ECO_SEC,"Wholesale machinery, equipment and fittings "
Low,225,البيع بالجملة للمواد المستعملة والسكراب,ECO_SEC,Wholesale Buying Materials Heating and Adaptation 
Low,226,بيع مفرق أدوات كهربائيه وتجهيزات منزلية,ECO_SEC,Wholesale Used materials and jacket 
Low,227,البيع بالجملة للبضائع المنزلية الاخرى,ECO_SEC,Sell Junction Electrical Tools and Home Appliances 
Low,228,صيانة الادوات المنزلية والشخصية,ECO_SEC,Wholesale other household goods 
Low,229,تجارة الاثاث,ECO_SEC,Maintenance of household and personal tools 
Low,230,تجارة اجهزة الكمبيوتر و مستلزماتها,ECO_SEC,Furniture trade 
Low,231,بيع بالجملة لمواد خام زراعيةحيوانات حية,ECO_SEC,Computer and accessories trade 
Low,233,بيع بالجملة لوقود س وص والغاز ومشتقاتها,ECO_SEC,Wholesale raw materials agricultural animals 
Low,234,البيع بالجملة للمعادن وخاماتها,ECO_SEC,"Wholesale for fuel, gas and their derivatives "
Low,235,بيع مفرق للأدوات المعدنية دهان والزجاج,ECO_SEC,Wholesale for metals and raw materials 
Low,237,تجارة الاعلاف,ECO_SEC,Sell junction for metal tools and glass paint 
Low,238,البيع بالجملة لمنسوجات وملابس والاحذية,ECO_SEC,Feed trade 
Low,239,ب مفرق منسوجات،ملابس،احذية ومنتجات جلدية,ECO_SEC,"Wholesale for textiles, clothing and shoes "
Low,24,الاقمشة والاجواخ والملبوسات الصوفية,ECO_SEC,"B, Textiles, Clothing, Shoes and Leather Products "
Low,240,بيع مفرق مواد طبية و ادوية ومواد تجميلية,ECO_SEC,"Fabrics, cottages and woolen clothes "
Low,241, تجارة شركات مواد البناء والأدوات الصحيه,ECO_SEC,"Selling the junction of medical, medicines and cosmetics "
Low,242,البيع بالجملة مقابل عقد,ECO_SEC,Trading of building materials and health items 
Low,243,بيع المفرق في الاسواق,ECO_SEC,Wholesale vs contract 
Low,244,بيع مفرق في اماكن غير المحلات التجارية,ECO_SEC,Sell retail in markets 
Low,245,بيع المفرق للمواد المستعملة في المحلات,ECO_SEC,Sell junction in non-shop places 
Low,246,البيع بالجملة للمنتجات الاخرى,ECO_SEC,Sell Al Mafraq Used Materials in Shops 
Low,247,تجارة الادوات الرياضية,ECO_SEC,Wholesale other products 
Low,248,تجارة البواخر والقوارب وصيانتها,ECO_SEC,Trade Sports Tools 
Low,249,تجارة الادوات الزراعية,ECO_SEC,Commerce and maintenance of boats 
Low,25,الحقائب والصناعات الجلدية الاخرى,ECO_SEC,Agricultural Tools Trade 
Low,250,تجارة الطائرات صيانتها,ECO_SEC,Other leather bags and industries 
Low,251,النقل الجوي (ركاب),ECO_SEC,Trade aircraft maintenance 
Low,252,النقل الجوي (بضائع),ECO_SEC,Air Transport (Passengers) 
Low,253,النقل بواسطة السكك الحديديه,ECO_SEC,Air Transport (Goods) 
Low,254,نقل مسافرين برا,ECO_SEC,Transport by rail 
Low,256,نقل بضائع برا,ECO_SEC,Transfer of travelers land 
Low,257,نقل مسافرين بحرا,ECO_SEC,Transportation of goods by land 
Low,258,الموانئ,ECO_SEC,Transfer of travelers by sea 
Low,259,وكلاء النقل والشحن,ECO_SEC,Ports 
Low,26,الادوات الكهربائية والرافعات والمصاعد,ECO_SEC,Transport and shipping agents 
Low,260, خدمات النقل للمخازن والمستودعات,ECO_SEC,"Electrical tools, cranes and lifts "
Low,261,البريد,ECO_SEC,Transportation services for stores and warehouses 
Low,262,الضيافة خلال فترة اقامة قصيرة في الفندق,ECO_SEC,Mail 
Low,263,المطاعم ، البار والكفتيريا,ECO_SEC,Hospitality during a short stay at the hotel 
Low,264,بناء /توسعة/صيانة الفنادق,ECO_SEC,"Restaurants, bar and kettle "
Low,265,تأجير معدات النقل,ECO_SEC,Construction / Expansion / Maintenance of hotels 
Low,266,تأجير الالات والمعدات الزراعية,ECO_SEC,Rental of transport equipment 
Low,267,تأجير الات ومعدات بناء وهندسةمدنية,ECO_SEC,Rental of agricultural machinery and equipment 
Low,268,تأجير الالات والمعدات الاخرى,ECO_SEC,Rental of construction machinery and equipment 
Low,269,تأجير الادوات المنزلية والشخصية,ECO_SEC,Hire machines and other equipment 
Low,27,الاسفنج ومحارم الورق,ECO_SEC,Hire household and personal tools 
Low,270,تأجير السيارات,ECO_SEC,Sponge and papers 
Low,271,استشارات البرمجة,ECO_SEC,Car Rental 
Low,272,صيانة الاجهزة المكتبية والكمبيوترات,ECO_SEC,Programming consulting 
Low,273,خدمات الكمبيوتر الاخرى,ECO_SEC,Maintenance of office equipment and computers 
Low,274,بحث وتطوير في علوم طبيعية وهندسة,ECO_SEC,Other computer services 
Low,275,الخدمات القانونية,ECO_SEC,Search and development in natural sciences and engineering 
Low,276,المحاسبة والتدقيق والاستشارات الضريبية,ECO_SEC,Legal services 
Low,277,الابحاث والاستبيانات,ECO_SEC,"Accounting, auditing and tax consulting "
Low,278,الاستشارات الادارية,ECO_SEC,Research and questionnaires 
Low,279,الاستشارات الهندسية والفنية,ECO_SEC,Administrative consulting 
Low,28,صناعات وسيطة اخرى,ECO_SEC,Engineering and technical consulting 
Low,280,الفحص والتحليل الفني,ECO_SEC,Other intermediate industries 
Low,281,الدعاية,ECO_SEC,Scan and technical analysis 
Low,282,التوظيف وتعيين الكفاءات,ECO_SEC,Hype 
Low,283,الامن والتفتيش,ECO_SEC,Employment and appointment of competencies 
Low,284,خدمات التنظيف,ECO_SEC,Security and inspection 
Low,285,التصوير الفوتوغرافي,ECO_SEC,Cleaning services 
Low,286,خدمات التغليف,ECO_SEC,photographer 
Low,287,الاستشارات القانونية,ECO_SEC,Packaging services 
Low,288,الخدمات الاخرى,ECO_SEC,Legal advice 
Low,289,شركات التخليص و النقل,ECO_SEC,Other services 
Low,29,معادن أخرى,ECO_SEC,Clearance and transport companies 
Low,290,انتاج وتوزيع الفيديو,ECO_SEC,Other metals 
Low,291,انتاج الصور المتحركة,ECO_SEC,Production and distribution of video 
Low,292,الراديو والتلفزيون,ECO_SEC,Production of animation 
Low,293,الفنون الدرامية والموسيقى,ECO_SEC,Radio and TV 
Low,294,النشاطات الترفيهية الاخرى,ECO_SEC,Drama and music arts 
Low,295,وكالات الاخبار,ECO_SEC,Other recreational activities 
Low,296,نشاطات الاستجمام الاخرى,ECO_SEC,News Agencies 
Low,297,النوادي الرياضية,ECO_SEC,Other Recreation Activities 
Low,298,غسيل وتجفيف المنسوجات والفراء,ECO_SEC,Sports clubs 
Low,299,تصفيف الشعر والتجميل,ECO_SEC,Washing and drying textiles and fur 
Low,30,تجارة مواد البناء دهانات،بلاط،أدوات صحية,ECO_SEC,Hairdressing and beauty 
Low,300,خدمات الجنائز,ECO_SEC,"Commercial Building Materials Paints, Tiles, Sanitaryware "
Low,301,التعليم الاساسي,ECO_SEC,Services of fans 
Low,302,التعليم الثانوي,ECO_SEC,the basic education 
Low,303,التعليم الثانوي المهني والصناعي,ECO_SEC,high school 
Low,304,التعليم العالي,ECO_SEC,Professional and industrial secondary education 
Low,305,الخدمات التعليمية الاخرى,ECO_SEC,Higher Education 
Low,306,  المستشفيات والصيدليات,ECO_SEC,Other educational services 
Low,307,الطب العام والاسنان,ECO_SEC,Hospitals and pharmacies 
Low,308,الخدمات الصحية الاخرى,ECO_SEC,General Medicine and Years 
Low,309,الخدمات البيطرية,ECO_SEC,Other Health Services 
Low,31,الصناعات الزراعية (خارج المزرعة),ECO_SEC,Veterinary services 
Low,310,المختبرات الطبية و الاشعة,ECO_SEC,Agricultural Industries (Out of Farm) 
Low,311,معدات طبية/تجاري ميديكل,ECO_SEC,Medical and radiation laboratories 
Low,312,عيادات طبية/تجاري ميديكل,ECO_SEC,Medical / Commercial Medicine Equipment 
Low,313,شركة المياه,ECO_SEC,Medical / Commercial Medicine Clinics 
Low,314,شركه الكهرباء,ECO_SEC,Water Company 
Low,315,طاقة متجددة,ECO_SEC,Electricity Company 
Low,316,الشركات العامله بالإتصالات,ECO_SEC,Renewable energy 
Low,317,الهيئات الدينيه,ECO_SEC,Companies working for communications 
Low,318,الهيئات الخيريه,ECO_SEC,Religious bodies 
Low,319,الشركات العامله بالصرافه,ECO_SEC,Charitable bodies 
Low,32,صناعة الأثاث والمفروشات وأدوات المنزل,ECO_SEC,Companies working by client 
Low,320,البنوك,ECO_SEC,"Furniture industry, furnishings and household items "
Low,329,السيارات الشخصيه,ECO_SEC,Banks 
Low,33,الصناعات الغذائية ومصانع الحلويات,ECO_SEC,Personal cars 
Low,330,السلع المعمره,ECO_SEC,Food industries and sweets factories 
Low,331,سلع اخرى,ECO_SEC,Goods 
Low,332,التعليم,ECO_SEC,Other goods 
Low,333,العنايه الطبيه,ECO_SEC,Education 
Low,334,سلف شخصيه بضمان رواتب محوله,ECO_SEC,Medical care 
Low,335,سلف شخصيه بضمان رواتب  غيرمحوله,ECO_SEC,Personal advances by guarantee salaries 
Low,336,سلف شخصية بضمان تأمينات نقدية,ECO_SEC,Personal advances by guarantee 
Low,338,شراء عقارات لأغراض السكن,ECO_SEC,Personal advances guarantee cash insurance 
Low,339,شراء الابنيه للصيانه / التوسعه / التحسين,ECO_SEC,Buy real estate for housing purposes 
Low,34,صناعة التبغ والمشروبات الروحية,ECO_SEC,Purchase of self-finance / expansion / improvement 
Low,340,بناء مساكن,ECO_SEC,Tobacco industry and spirits 
Low,341,المؤسسات الحكوميه,ECO_SEC,Building housing 
Low,342,الوزارات,ECO_SEC,Governmental institutions 
Low,343,الهيئات العامه الحكوميه,ECO_SEC,Ministries 
Low,344,المؤسسات شبه الحكوميه,ECO_SEC,Government General Authorities 
Low,345,كفاله الحكومه,ECO_SEC,Semi-government institutions 
Low,346,زراعة مروية,ECO_SEC,Guaranteed government 
Low,347,زراعة تقليدية (غير مروية),ECO_SEC,Myroid cultivation 
Low,349,المناجم ومقالع الحجارة,ECO_SEC,Traditional cultivation (non-irrigated) 
Low,35,صناعة الالمنيوم والحديد والمعادن,ECO_SEC,Mines and quarries 
Low,350,صناعة المنتجات الغذائية والمشروبات,ECO_SEC,"Aluminum, iron and metal industry "
Low,351,صناعة منتجات التبغ,ECO_SEC,Food and beverage products industry 
Low,352,تصنيع المنسوجات,ECO_SEC,Manufacture of tobacco products 
Low,353,صناعة ودباغة الملابس الجاهزة,ECO_SEC,Textile Manufacturing 
Low,354,دباغة الجلود وتصنيع الحقائب والاحذية,ECO_SEC,Manufacture and tanning garments 
Low,355,الصناعات الخشبية والفلينية عدا الاثاث,ECO_SEC,Tanning leather and manufacturing bags and shoes 
Low,356,صناعة الورق والمنتجات الورقية,ECO_SEC,Wood and Filing Industries except furniture 
Low,357,نشر وطباعة واعادة انتاج وسائل الاعلام,ECO_SEC,Paper and paper products 
Low,358,صناعة الفحم ومشتقات البترول المكررة,ECO_SEC,"Publish, print and re-produce media "
Low,359,صناعة الكيماويات ومشتقاتها,ECO_SEC,Coal industry and duplicate petroleum products 
Low,36,صناعة الورق,ECO_SEC,Chemical industry and derivatives 
Low,360,صناعة المنتجات البلاستيكية والمطاطية,ECO_SEC,Paper Industry 
Low,361,صناعة المنتجات غير المعدنية,ECO_SEC,Manufacture of plastic and rubber products 
Low,362,صناعة المعادن,ECO_SEC,Industrial products non-metallic 
Low,363,صناعة منتجات معدنية دون الآلات والمعدات,ECO_SEC,Metal industry 
Low,364,صناعة الآلات والمعدات,ECO_SEC,Manufacture of metal products without machinery and equipment 
Low,365,صناعة الادوات الكهربائية,ECO_SEC,Machinery and equipment industry 
Low,366,صناعة اجهزة راديو وتلفزيون وسائل اتصال,ECO_SEC,Electrical Tools Industry 
Low,367,صناعات طبية، المعدات البصرية والساعات,ECO_SEC,Manufacture of radio and television equipment 
Low,368,صناعة السيارات ، القاطرات والمقطورات,ECO_SEC,"Medical Industries, Optical Equipment and Watches "
Low,369,صناعة وسائل النقل الاخرى,ECO_SEC,"Automotive industry, locomotives and trailers "
Low,37,صناعات تحويلية اخرى,ECO_SEC,Other transportation industry 
Low,370,صناعة الاثاث والصناعات الاخرى,ECO_SEC,Other transformations 
Low,371,الجمعيات التعاونيه الإسكانيه,ECO_SEC,Furniture industry and other industries 
Low,372,شراء أراضي وابنيه,ECO_SEC,Cooperative Associations 
Low,373,ت مواد غ وتبغ ومشروبات كحوليه وغازيه,ECO_SEC,Buy land and profession 
Low,374,تجارة المعدات والالات,ECO_SEC,"Materials, dye and behavior and gas "
Low,375,تجارة مواد الكهربائيه والمنزليه و الاثاث,ECO_SEC,Trade equipment and machinery 
Low,376,تجارة المواد الأوليه,ECO_SEC,"Trading of electrical, household and furniture "
Low,377,تجارة الأدويه ومواد تجميل ومواد كيماويه,ECO_SEC,Trade of primary materials 
Low,378,تجارة المستلزمات الاخرى,ECO_SEC,"Pharmaceutical trade, beauty materials and chemicals "
Low,379,خدمات النقل الإضافي والمساعده,ECO_SEC,Other supplies trade 
Low,380,خدمات البريد,ECO_SEC,Additional and assistant transport services 
Low,381,الفنادق والمطاعم,ECO_SEC,Postal Services 
Low,382,تأجير الات ومعدات وادوات منزلية وشخصية,ECO_SEC,Hotels and restaurants 
Low,383,خدمات الكمبيوتر,ECO_SEC,"Hire machinery, equipment, household and personal tools "
Low,384,البحث والتطوير,ECO_SEC,computer Services 
Low,385,خدمات الاعمال الاخرى,ECO_SEC,research and development 
Low,386,الرياضة والثقافة والاستجمام,ECO_SEC,Other Business Services 
Low,387,الإتصالات السلكيه واللاسلكيه,ECO_SEC,"Sports, culture and recreation "
Low,389,شركات الإقراض,ECO_SEC,wired and wireless communication 
Low,39,الغزل والنسيج,ECO_SEC,Lending companies 
Low,393,بهدف شراء أدوات ملموسه,ECO_SEC,Textile 
Low,394,بهدف شراء خدمه,ECO_SEC,With a view to buying tangible tools 
Low,396,شراء عقارات لأغراض السكن,ECO_SEC,With a view to buying a service 
Low,398,الزراعه بدون وسائل الري (بعل),ECO_SEC,Buy real estate for housing purposes 
Low,399, صناعة كاكاو وشوكولاته وحلويات وخبز,ECO_SEC,Agriculture without irrigation methods (Baal) 
Low,40,تجارة المواد الغذائية,ECO_SEC,"Cocoa and chocolate industry, sweets and bread "
Low,400,صناعة المنتجات الغذائية الاخرى,ECO_SEC,Food trade 
Low,401,صناعة منتجات التبغ,ECO_SEC,Industrial food products 
Low,402,صناعة الاقمشة الجاهزة عدا الملابس,ECO_SEC,Manufacture of tobacco products 
Low,403,صناعة حقائب السفرواليد والسروج,ECO_SEC,Manufacture of ready-made fabrics except clothing 
Low,404,صناعة الاحذية,ECO_SEC,Manufacture of travel and bridging bags 
Low,405,نشروتسطيح الاخشاب,ECO_SEC,Shoe manufacturing 
Low,406,صناعة الألواح الخشبية المختلفة,ECO_SEC,Publish the wood 
Low,407,صناعة أخشاب النجارة والبناء,ECO_SEC,Different wood panels industry 
Low,408,صناعة منتجات ورقية وكرتونية اخرى,ECO_SEC,Manufacture of woodworking and construction 
Low,409,زراعه حمضيات فواكه وقمح وحبوب( ري حديثه),ECO_SEC,Industrial and other paper products 
